{
  "run_id": "stage07",
  "profile": "full",
  "created_at": "2026-03-16T23:59:12.362604+00:00",
  "artifacts": [
    {
      "artifact_id": "07_dataset_air",
      "stage_id": "07",
      "artifact_type": "dataset",
      "path": "data\\processed\\air_sensitivity_ground_only.parquet",
      "format": "parquet",
      "artifact_role": "",
      "scenario_id": "ground_only"
    },
    {
      "artifact_id": "07_table_air",
      "stage_id": "07",
      "artifact_type": "table",
      "path": "outputs\\tables\\07_tables_air_sensitivity_ground_only.csv",
      "format": "csv",
      "artifact_role": "",
      "scenario_id": "ground_only"
    },
    {
      "artifact_id": "07_fig_air",
      "stage_id": "07",
      "artifact_type": "figure",
      "path": "outputs\\figures\\07_figures_air_sensitivity_ground_only.png",
      "format": "png",
      "artifact_role": "",
      "scenario_id": "ground_only"
    },
    {
      "artifact_id": "07_finding",
      "stage_id": "07",
      "artifact_type": "finding",
      "path": "outputs\\metrics\\07_findings_ground_only.json",
      "format": "json",
      "artifact_role": "",
      "scenario_id": "ground_only"
    }
  ]
}